PubmedID,Title,Publication Date,Non-Academic Authors,Company Affiliations,Corresponding Author Email
40066659,Inhibition of HDAC4 in granulosa cells improved co-cultured oocyte maturation in vitro independent of LH in porcine.,2025-Mar-11,,"Zuo, Bao, Lin, Li, Wang, Xia, Wang",Not Available
40066656,Socioeconomic Disparities in Prostate Cancer Treatment: The Impact of Area Deprivation Index on Initial Treatment Type for Localized PCa in a North-American Cohort.,2025-Mar-11,Stephens,,Not Available
40066655,The role of surgical resection of the primary tumor in metastatic upper tract urothelial carcinoma: a systematic review and meta-analysis.,2025-Mar-11,,,Not Available
40066650,"Chronotype, sleep timing, sleep regularity, and cancer risk: A systematic review.",2025-Mar-11,"VoPham, Phipps",,Not Available
40066574,Influence of handgrip strength on postoperative complications and survival in primary liver cancer patients.,2025-Mar-04,,,Not Available
